{
  "$id": "https://kjanat.github.io/runner/schemas/doctor.v1.schema.json",
  "$schema": "https://json-schema.org/draft/2020-12/schema",
  "$defs": {
    "Decisions": {
      "description": "Resolver verdict surface. Mirrors the resolver's `Result` so\nconsumers can branch on the variant before reading the inner shape.",
      "type": "object",
      "required": [
        "node_pm"
      ],
      "properties": {
        "node_pm": {
          "$ref": "#/$defs/NodePmDecision",
          "description": "Node script-dispatch PM decision, or an error message when the\nresolver bailed."
        }
      }
    },
    "Detected": {
      "description": "Detection results — what the file scan found, before any resolver\npolicy was applied.",
      "type": "object",
      "required": [
        "current_node",
        "monorepo",
        "node_version",
        "package_managers",
        "task_runners"
      ],
      "properties": {
        "current_node": {
          "description": "`node --version` output, when the binary is on PATH.",
          "type": [
            "null",
            "string"
          ]
        },
        "monorepo": {
          "description": "Whether the project looks like a monorepo (workspace globs).",
          "type": "boolean"
        },
        "node_version": {
          "description": "`.nvmrc` / `.node-version` / `engines.node` declaration.",
          "anyOf": [
            {
              "$ref": "#/$defs/NodeVersionInfo"
            },
            {
              "type": "null"
            }
          ]
        },
        "package_managers": {
          "description": "Detected package managers, in detection-priority order.",
          "type": "array",
          "items": {
            "type": "string"
          }
        },
        "task_runners": {
          "description": "Detected task runners.",
          "type": "array",
          "items": {
            "type": "string"
          }
        }
      }
    },
    "ManifestPm": {
      "description": "Manifest-level PM declaration plus the field it came from.",
      "type": "object",
      "required": [
        "on_fail",
        "pm",
        "source",
        "version"
      ],
      "properties": {
        "on_fail": {
          "description": "Effective `onFail` policy (`\"ignore\"`, `\"warn\"`, `\"error\"`).",
          "type": "string"
        },
        "pm": {
          "description": "Declared PM label.",
          "type": "string"
        },
        "source": {
          "description": "Either `\"packageManager\"` or `\"devEngines.packageManager\"`.",
          "type": "string"
        },
        "version": {
          "description": "Version constraint as written, if present.",
          "type": [
            "null",
            "string"
          ]
        }
      }
    },
    "NodePmDecision": {
      "description": "Either a resolved Node PM or the diagnostic string for the failure\nthat prevented one. Untagged so consumers can probe via \"is the\n`pm` field present?\".",
      "anyOf": [
        {
          "description": "Successful resolution.",
          "type": "object",
          "required": [
            "pm",
            "via"
          ],
          "properties": {
            "pm": {
              "description": "The chosen PM label.",
              "type": "string"
            },
            "via": {
              "description": "Human-readable `via` line — the same string `--explain` prints.",
              "type": "string"
            }
          }
        },
        {
          "description": "Resolver bailed; carries the rendered error message.",
          "type": "object",
          "required": [
            "error"
          ],
          "properties": {
            "error": {
              "description": "One-line error description from `ResolveError::Display`.",
              "type": "string"
            }
          }
        }
      ]
    },
    "NodeSignals": {
      "description": "Node-ecosystem detection signals: lockfile, manifest, PATH probe.",
      "type": "object",
      "required": [
        "lockfile_pm",
        "manifest_pm",
        "path_probe"
      ],
      "properties": {
        "lockfile_pm": {
          "description": "PM inferred from the highest-priority lockfile, if any.",
          "type": [
            "null",
            "string"
          ]
        },
        "manifest_pm": {
          "description": "Manifest declaration (legacy `packageManager` or `devEngines`).",
          "anyOf": [
            {
              "$ref": "#/$defs/ManifestPm"
            },
            {
              "type": "null"
            }
          ]
        },
        "path_probe": {
          "description": "`bun`/`pnpm`/`yarn`/`npm` -> absolute path on `$PATH` (or null).",
          "type": "object",
          "additionalProperties": {
            "type": [
              "null",
              "string"
            ]
          }
        },
        "volta_shims": {
          "description": "PATH-probe hits identified as Volta shims, keyed like\n[`Self::path_probe`]. Additive field (no schema bump): absent on\nhosts without Volta and on surfaces that skip shim resolution.",
          "type": "object",
          "additionalProperties": {
            "$ref": "#/$defs/VoltaShimInfo"
          }
        }
      }
    },
    "NodeVersionInfo": {
      "description": "Node version declaration plus the file it came from.",
      "type": "object",
      "required": [
        "expected",
        "source"
      ],
      "properties": {
        "expected": {
          "description": "Version string as written (e.g. `\"20.11.0\"`, `\">=18\"`).",
          "type": "string"
        },
        "source": {
          "description": "Source file that declared the version (e.g. `\".nvmrc\"`).",
          "type": "string"
        }
      }
    },
    "OverridesView": {
      "description": "Materialised override stack — the inputs that fed into resolver\ndecisions.",
      "type": "object",
      "required": [
        "explain",
        "fallback",
        "no_warnings",
        "on_mismatch",
        "pm",
        "pm_by_ecosystem",
        "prefer_runners",
        "runner"
      ],
      "properties": {
        "explain": {
          "description": "Whether the explain trace is on.",
          "type": "boolean"
        },
        "fallback": {
          "description": "Active `FallbackPolicy` label.",
          "type": "string"
        },
        "no_warnings": {
          "description": "Whether warnings are suppressed.",
          "type": "boolean"
        },
        "on_mismatch": {
          "description": "Active `MismatchPolicy` label.",
          "type": "string"
        },
        "pm": {
          "description": "Cross-ecosystem PM override from `--pm` / `RUNNER_PM`.",
          "anyOf": [
            {
              "$ref": "#/$defs/PmOverrideInfo"
            },
            {
              "type": "null"
            }
          ]
        },
        "pm_by_ecosystem": {
          "description": "Per-ecosystem PM overrides from `runner.toml [pm].<eco>`.",
          "type": "object",
          "additionalProperties": {
            "$ref": "#/$defs/PmOverrideInfo"
          }
        },
        "prefer_runners": {
          "description": "Ranked preference list from `[task_runner].prefer`.",
          "type": "array",
          "items": {
            "type": "string"
          }
        },
        "runner": {
          "description": "`--runner` / `RUNNER_RUNNER` override.",
          "anyOf": [
            {
              "$ref": "#/$defs/RunnerOverrideInfo"
            },
            {
              "type": "null"
            }
          ]
        }
      }
    },
    "PmOverrideInfo": {
      "description": "PM override + provenance.",
      "type": "object",
      "required": [
        "origin",
        "pm"
      ],
      "properties": {
        "origin": {
          "description": "`\"cli\"`, `\"env\"`, or `\"config:/abs/path\"`.",
          "type": "string"
        },
        "pm": {
          "description": "The chosen PM label.",
          "type": "string"
        }
      }
    },
    "RunnerOverrideInfo": {
      "description": "Task-runner override + provenance.",
      "type": "object",
      "required": [
        "origin",
        "runner"
      ],
      "properties": {
        "origin": {
          "description": "`\"cli\"`, `\"env\"`, or `\"config:/abs/path\"`.",
          "type": "string"
        },
        "runner": {
          "description": "The chosen runner label.",
          "type": "string"
        }
      }
    },
    "Signals": {
      "description": "Per-ecosystem signals — what the resolver had to work with.",
      "type": "object",
      "required": [
        "node"
      ],
      "properties": {
        "node": {
          "$ref": "#/$defs/NodeSignals",
          "description": "Node-ecosystem signals. The schema is intentionally\nnode-flat today; other ecosystems get peer fields as their\nresolver paths land."
        }
      }
    },
    "TaskInfo": {
      "description": "Task entry projected into the JSON shape.",
      "type": "object",
      "required": [
        "name",
        "source"
      ],
      "properties": {
        "alias_of": {
          "description": "When the task is an alias, the target it resolves to.",
          "type": [
            "null",
            "string"
          ]
        },
        "description": {
          "description": "Human-readable description, if any.",
          "type": [
            "null",
            "string"
          ]
        },
        "name": {
          "description": "Task name as it appears in the config.",
          "type": "string"
        },
        "passthrough_to": {
          "description": "When the task's body is a thin wrapper for another runner.",
          "type": [
            "null",
            "string"
          ]
        },
        "source": {
          "$ref": "#/$defs/TaskSourceLabel"
        }
      }
    },
    "TaskSourceLabel": {
      "type": "string",
      "enum": [
        "package.json",
        "Makefile",
        "justfile",
        "Taskfile",
        "turbo.json",
        "deno.json",
        "cargo",
        "go",
        "bacon.toml",
        "mise.toml",
        "pyproject.toml"
      ]
    },
    "VoltaShimInfo": {
      "description": "What `volta which` said about one shimmed tool.",
      "type": "object",
      "required": [
        "resolved"
      ],
      "properties": {
        "resolved": {
          "description": "Real provisioned binary behind the shim; `null` when Volta has\nno version of the tool (\"not provisioned\"). Shims Volta could\nnot classify at all are omitted from the map instead of guessed.",
          "type": [
            "null",
            "string"
          ]
        }
      }
    },
    "WarningInfo": {
      "description": "Warning projected into the JSON shape. The `source`/`detail` split\nis kept stable from the pre-A4 flat-struct days so existing\nconsumers (the `doctor` test suite, ad-hoc `jq` queries) keep\nworking.",
      "type": "object",
      "required": [
        "detail",
        "source"
      ],
      "properties": {
        "detail": {
          "description": "Human-readable detail.",
          "type": "string"
        },
        "source": {
          "description": "Subsystem the warning came from (e.g. `\"package.json\"`).",
          "type": "string"
        }
      }
    }
  },
  "title": "runner doctor --json --schema-version 1",
  "description": "JSON schema for the legacy v1 `runner doctor --json` document. v1 uses filename-style task source labels.",
  "type": "object",
  "required": [
    "decisions",
    "detected",
    "ecosystems",
    "overrides",
    "root",
    "schema_version",
    "signals",
    "warnings"
  ],
  "properties": {
    "$schema": {
      "description": "URI of the JSON Schema that describes this payload.",
      "type": "string"
    },
    "decisions": {
      "$ref": "#/$defs/Decisions",
      "description": "Resolver verdict (or first-class error if the chain bailed)."
    },
    "detected": {
      "$ref": "#/$defs/Detected",
      "description": "Raw, type-deduplicated detection results: PMs, runners, Node\nversion, monorepo flag. Stable across resolver behavior tweaks."
    },
    "ecosystems": {
      "description": "Detected ecosystems, in the order their package managers were\nfound by [`crate::detect`].",
      "type": "array",
      "items": {
        "type": "string"
      }
    },
    "overrides": {
      "$ref": "#/$defs/OverridesView",
      "description": "Effective override stack — CLI, env, and config bundled."
    },
    "root": {
      "description": "Absolute path of the project root the report describes.",
      "type": "string"
    },
    "schema_version": {
      "description": "Schema contract version for this JSON payload.",
      "type": "integer",
      "const": 1,
      "minimum": 0,
      "format": "uint32"
    },
    "signals": {
      "$ref": "#/$defs/Signals",
      "description": "Per-ecosystem detection signals: lockfile pick, manifest\ndeclaration, PATH probe results."
    },
    "tasks": {
      "description": "Full task list. Subcommands that don't care omit this via\nprojection.",
      "type": "array",
      "items": {
        "$ref": "#/$defs/TaskInfo"
      }
    },
    "warnings": {
      "description": "Diagnostic warnings from both detection (`ctx.warnings`) and\nthe resolver (`ResolvedPm.warnings`), flattened.",
      "type": "array",
      "items": {
        "$ref": "#/$defs/WarningInfo"
      }
    }
  }
}
