{
  "schema_version": 1,
  "root": "/path/to/project",
  "ecosystems": [
    "node",
    "rust"
  ],
  "detected": {
    "package_managers": [
      "bun",
      "cargo"
    ],
    "task_runners": [
      "just"
    ],
    "node_version": null,
    "current_node": "24.0.0",
    "monorepo": true
  },
  "overrides": {
    "pm": null,
    "pm_by_ecosystem": {},
    "runner": null,
    "prefer_runners": [],
    "fallback": "probe",
    "on_mismatch": "warn",
    "explain": false,
    "no_warnings": false
  },
  "signals": {
    "node": {
      "lockfile_pm": "bun",
      "manifest_pm": {
        "pm": "bun",
        "source": "packageManager",
        "version": "1.0.0",
        "on_fail": "ignore"
      },
      "path_probe": {
        "bun": "/usr/local/bin/bun",
        "npm": "/opt/volta/bin/npm",
        "pnpm": null,
        "yarn": "/opt/volta/bin/yarn"
      },
      "volta_shims": {
        "npm": {
          "resolved": "/opt/volta/tools/image/npm/10.0.0/bin/npm"
        },
        "yarn": {
          "resolved": null
        }
      }
    }
  },
  "decisions": {
    "node_pm": {
      "pm": "bun",
      "via": "bun via package.json \"packageManager\""
    }
  },
  "tasks": [
    {
      "name": "fmt",
      "source": "package.json"
    },
    {
      "name": "fmt:update",
      "source": "package.json"
    },
    {
      "name": "typecheck",
      "source": "package.json"
    },
    {
      "name": "build-packages",
      "source": "justfile"
    },
    {
      "name": "default",
      "source": "justfile"
    },
    {
      "name": "gen-schema",
      "source": "justfile",
      "description": "Drift guard: just gen-schema && git diff --exit-code schemas/"
    },
    {
      "name": "ls",
      "source": "justfile"
    },
    {
      "name": "run",
      "source": "justfile"
    },
    {
      "name": "runner",
      "source": "justfile"
    },
    {
      "name": "test-release",
      "source": "justfile",
      "description": "Build release bin and verify the facade shims spawn the native binary."
    },
    {
      "name": "b",
      "source": "cargo",
      "alias_of": "build"
    },
    {
      "name": "bb",
      "source": "cargo",
      "alias_of": "build --bin run --bin runner"
    },
    {
      "name": "bbr",
      "source": "cargo",
      "alias_of": "build --bin run --bin runner --release"
    },
    {
      "name": "bin-run",
      "source": "cargo",
      "alias_of": "run --quiet --bin run"
    },
    {
      "name": "bin-runner",
      "source": "cargo",
      "alias_of": "run --quiet --bin runner"
    },
    {
      "name": "c",
      "source": "cargo",
      "alias_of": "check"
    },
    {
      "name": "cl",
      "source": "cargo",
      "alias_of": "clippy --all-targets --all-features"
    },
    {
      "name": "comp",
      "source": "cargo",
      "alias_of": "run --quiet --bin runner -- completions"
    },
    {
      "name": "d",
      "source": "cargo",
      "alias_of": "doc"
    },
    {
      "name": "f",
      "source": "cargo",
      "alias_of": "run --quiet --bin run -- --pm npm dprint fmt"
    },
    {
      "name": "format",
      "source": "cargo",
      "alias_of": "run --quiet --bin run -- --pm npm dprint fmt"
    },
    {
      "name": "i",
      "source": "cargo",
      "alias_of": "install --path ."
    },
    {
      "name": "l",
      "source": "cargo",
      "alias_of": "clippy --all-targets --all-features -- -D warnings -D clippy::all"
    },
    {
      "name": "lint",
      "source": "cargo",
      "alias_of": "clippy --all-targets --all-features -- -D warnings -D clippy::all"
    },
    {
      "name": "man",
      "source": "cargo",
      "alias_of": "run --quiet --features man -- man"
    },
    {
      "name": "meta",
      "source": "cargo",
      "alias_of": "metadata --format-version 1"
    },
    {
      "name": "r",
      "source": "cargo",
      "alias_of": "run"
    },
    {
      "name": "rbin-run",
      "source": "cargo",
      "alias_of": "run --quiet --bin run --release"
    },
    {
      "name": "rbin-runner",
      "source": "cargo",
      "alias_of": "run --quiet --bin runner --release"
    },
    {
      "name": "rm",
      "source": "cargo",
      "alias_of": "remove"
    },
    {
      "name": "rq",
      "source": "cargo",
      "alias_of": "run --quiet"
    },
    {
      "name": "rr",
      "source": "cargo",
      "alias_of": "run --release"
    },
    {
      "name": "runner",
      "source": "cargo",
      "alias_of": "run --quiet --bin runner"
    },
    {
      "name": "schema",
      "source": "cargo",
      "alias_of": "run --quiet --features schema -- schema"
    },
    {
      "name": "t",
      "source": "cargo",
      "alias_of": "test"
    }
  ],
  "warnings": []
}
